reference,title,type,date,subject,url,status
2021/2128(DEC),2020 discharge: European Food Safety Authority (EFSA),Type.DEC,2021-06-30,"[""8.70.03.10""]",https://oeil.secure.europarl.europa.eu/oeil/popups/ficheprocedure.do?reference=2021/2128(DEC)&l=en,Procedure completed
2021/2131(DEC),2020 discharge: European Institute of Innovation and Technology (EIT),Type.DEC,2021-06-30,"[""8.70.03.10""]",https://oeil.secure.europarl.europa.eu/oeil/popups/ficheprocedure.do?reference=2021/2131(DEC)&l=en,Procedure completed
2021/2132(DEC),2020 discharge: European Medicines Agency (EMA),Type.DEC,2021-06-30,"[""8.70.03.10""]",https://oeil.secure.europarl.europa.eu/oeil/popups/ficheprocedure.do?reference=2021/2132(DEC)&l=en,Procedure completed
2021/2137(DEC),2020 discharge: Euratom Supply Agency (ESA),Type.DEC,2021-06-30,"[""8.70.03.10""]",https://oeil.secure.europarl.europa.eu/oeil/popups/ficheprocedure.do?reference=2021/2137(DEC)&l=en,Procedure completed
2021/2129(DEC),2020 discharge: European Institute for Gender Equality (EIGE),Type.DEC,2021-06-30,"[""8.70.03.10""]",https://oeil.secure.europarl.europa.eu/oeil/popups/ficheprocedure.do?reference=2021/2129(DEC)&l=en,Procedure completed
2021/0182(NLE),Hague Convention (1980) on the Civil Aspects of International Child Abduction: accession of Pakistan,Type.NLE,2021-07-06,"[""4.10.02"", ""4.10.03"", ""7.40.02""]",https://oeil.secure.europarl.europa.eu/oeil/popups/ficheprocedure.do?reference=2021/0182(NLE)&l=en,Awaiting final decision
2021/0198(NLE),Hague Convention (1980) on the Civil Aspects of International Child Abduction: accession of Tunisia,Type.NLE,2021-07-06,"[""4.10.02"", ""4.10.03"", ""7.40.02""]",https://oeil.secure.europarl.europa.eu/oeil/popups/ficheprocedure.do?reference=2021/0198(NLE)&l=en,Awaiting final decision
2021/2122(DEC),2020 discharge: European Asylum Support Office (EASO),Type.DEC,2021-06-30,"[""8.70.03.10""]",https://oeil.secure.europarl.europa.eu/oeil/popups/ficheprocedure.do?reference=2021/2122(DEC)&l=en,Procedure completed
2021/0191(COD),European green bonds,Type.COD,2021-07-06,"[""2.50.03"", ""3.70.20""]",https://oeil.secure.europarl.europa.eu/oeil/popups/ficheprocedure.do?reference=2021/0191(COD)&l=en,Procedure completed
2021/2116(DEC),2020 discharge: European Union Agency for the Cooperation of Energy Regulators (ACER),Type.DEC,2021-06-30,"[""8.70.03.10""]",https://oeil.secure.europarl.europa.eu/oeil/popups/ficheprocedure.do?reference=2021/2116(DEC)&l=en,Procedure completed
2021/0179(NLE),Hague Convention (1980) on the Civil Aspects of International Child Abduction: accession of Jamaica,Type.NLE,2021-07-06,"[""4.10.02"", ""4.10.03"", ""7.40.02""]",https://oeil.secure.europarl.europa.eu/oeil/popups/ficheprocedure.do?reference=2021/0179(NLE)&l=en,Awaiting final decision
2021/2121(DEC),2020 discharge: European Aviation Safety Agency (EASA),Type.DEC,2021-06-30,"[""8.70.03.10""]",https://oeil.secure.europarl.europa.eu/oeil/popups/ficheprocedure.do?reference=2021/2121(DEC)&l=en,Procedure completed
2021/2117(DEC),2020 discharge: Office of the Body of European Regulators for Electronic Communications (BEREC),Type.DEC,2021-06-30,"[""8.70.03.10""]",https://oeil.secure.europarl.europa.eu/oeil/popups/ficheprocedure.do?reference=2021/2117(DEC)&l=en,Procedure completed
2021/2118(DEC),2020 discharge: Translation Centre for the Bodies of the European Union (CdT),Type.DEC,2021-06-30,"[""8.70.03.10""]",https://oeil.secure.europarl.europa.eu/oeil/popups/ficheprocedure.do?reference=2021/2118(DEC)&l=en,Procedure completed
2021/2119(DEC),2020 discharge: European Centre for the Development of Vocational Training (CEDEFOP),Type.DEC,2021-06-30,"[""8.70.03.10""]",https://oeil.secure.europarl.europa.eu/oeil/popups/ficheprocedure.do?reference=2021/2119(DEC)&l=en,Procedure completed
2021/2140(DEC),"2020 discharge: European Union Agency for the operational management of large-scale IT systems in the area of freedom, security and justice (eu-LISA)",Type.DEC,2021-06-30,"[""8.70.03.10""]",https://oeil.secure.europarl.europa.eu/oeil/popups/ficheprocedure.do?reference=2021/2140(DEC)&l=en,Procedure completed
2021/2139(DEC),2020 discharge: European Training Foundation (ETF),Type.DEC,2021-06-30,"[""8.70.03.10""]",https://oeil.secure.europarl.europa.eu/oeil/popups/ficheprocedure.do?reference=2021/2139(DEC)&l=en,Procedure completed
2021/0226(BUD),Amending budget 5/2021: humanitarian support to refugees in Turkey,Type.BUD,2021-07-09,"[""7.10.06"", ""8.70.51""]",https://oeil.secure.europarl.europa.eu/oeil/popups/ficheprocedure.do?reference=2021/0226(BUD)&l=en,Procedure completed
2021/0184(NLE),Convention on the Conservation and Management of High Seas Fisheries Resources in the North Pacific Ocean: accession of the European Union,Type.NLE,2021-07-08,"[""3.15.01"", ""3.15.15.06""]",https://oeil.secure.europarl.europa.eu/oeil/popups/ficheprocedure.do?reference=2021/0184(NLE)&l=en,Procedure completed
2021/0227(BUD),2022 general budget: all sections,Type.BUD,2021-07-09,"[""8.70.52""]",https://oeil.secure.europarl.europa.eu/oeil/popups/ficheprocedure.do?reference=2021/0227(BUD)&l=en,Procedure completed
2021/2102(INI),The EEAS’s Climate Change and Defence Roadmap,Type.INI,2021-07-08,"[""3.70.03"", ""6.10.02""]",https://oeil.secure.europarl.europa.eu/oeil/popups/ficheprocedure.do?reference=2021/2102(INI)&l=en,Procedure completed
2021/2101(INI),The role of cohesion policy in promoting innovative and smart transformation and regional ICT connectivity,Type.INI,2021-07-08,"[""3.30.06"", ""3.40.06"", ""3.50.04"", ""4.70.02"", ""4.70.05""]",https://oeil.secure.europarl.europa.eu/oeil/popups/ficheprocedure.do?reference=2021/2101(INI)&l=en,Procedure completed
2021/2100(INI),Cohesion policy as an instrument to reduce healthcare disparities and enhance cross-border health cooperation,Type.INI,2021-07-08,"[""4.10.10"", ""4.20.06"", ""4.70.02"", ""4.70.05""]",https://oeil.secure.europarl.europa.eu/oeil/popups/ficheprocedure.do?reference=2021/2100(INI)&l=en,Procedure completed
2021/2103(INI),The shrinking space of civil society in Europe,Type.INI,2021-07-08,"[""1.10"", ""6.40.14"", ""8.30.10""]",https://oeil.secure.europarl.europa.eu/oeil/popups/ficheprocedure.do?reference=2021/2103(INI)&l=en,Procedure completed
2021/2099(INI),EU Citizenship Report 2020: empowering citizens and protecting their rights,Type.INI,2021-07-08,"[""1"", ""1.20""]",https://oeil.secure.europarl.europa.eu/oeil/popups/ficheprocedure.do?reference=2021/2099(INI)&l=en,Procedure completed
2021/2097(INI),A European Withholding Tax framework,Type.INI,2021-07-08,"[""2.50"", ""2.70""]",https://oeil.secure.europarl.europa.eu/oeil/popups/ficheprocedure.do?reference=2021/2097(INI)&l=en,Procedure completed
2021/2080(INI),Reaching women's economic independence through entrepreneurship and self-employment,Type.INI,2021-07-08,"[""3.45.06"", ""4.10.09"", ""4.15.08""]",https://oeil.secure.europarl.europa.eu/oeil/popups/ficheprocedure.do?reference=2021/2080(INI)&l=en,Procedure completed
2021/2079(INI),Islands and cohesion policy: current situation and future challenges,Type.INI,2021-07-08,"[""4.70.02"", ""4.70.06""]",https://oeil.secure.europarl.europa.eu/oeil/popups/ficheprocedure.do?reference=2021/2079(INI)&l=en,Procedure completed
2021/2098(INI),Mental Health in the Digital World of Work,Type.INI,2021-07-08,"[""3.30.06"", ""4.15.15"", ""4.20""]",https://oeil.secure.europarl.europa.eu/oeil/popups/ficheprocedure.do?reference=2021/2098(INI)&l=en,Procedure completed
2021/0228(COD),Cross-border infrastructure linking the Union and the United Kingdom through the Channel Fixed Link,Type.COD,2021-07-13,"[""3.20.02.01"", ""3.20.15.08""]",https://oeil.secure.europarl.europa.eu/oeil/popups/ficheprocedure.do?reference=2021/0228(COD)&l=en,Procedure completed
2021/0209(CNS),Canary Islands: temporary suspension of autonomous Common Customs Tariff duties on imports of certain industrial products,Type.CNS,2021-07-14,"[""2.10.01"", ""4.70.06"", ""8.70.01""]",https://oeil.secure.europarl.europa.eu/oeil/popups/ficheprocedure.do?reference=2021/0209(CNS)&l=en,Procedure completed
2021/0204(COD),Notification under the Carbon Offsetting and Reduction Scheme for International Aviation (CORSIA),Type.COD,2021-07-14,"[""3.20.01"", ""3.20.15.02"", ""3.70.02"", ""3.70.03"", ""3.70.18""]",https://oeil.secure.europarl.europa.eu/oeil/popups/ficheprocedure.do?reference=2021/0204(COD)&l=en,Procedure completed
2021/0202(COD),Revision of the Market Stability Reserve for the EU Emissions Trading System,Type.COD,2021-07-14,"[""3.70.02"", ""3.70.03"", ""3.70.18""]",https://oeil.secure.europarl.europa.eu/oeil/popups/ficheprocedure.do?reference=2021/0202(COD)&l=en,Procedure completed
2021/0211(COD),Revision of the EU Emissions Trading System,Type.COD,2021-07-14,"[""3.20.03"", ""3.60.08"", ""3.70.02"", ""3.70.03"", ""3.70.18""]",https://oeil.secure.europarl.europa.eu/oeil/popups/ficheprocedure.do?reference=2021/0211(COD)&l=en,Awaiting Parliament's position in 1st reading
2021/0207(COD),Revision of the EU Emissions Trading System for aviation,Type.COD,2021-07-14,"[""3.20.01"", ""3.20.15.02"", ""3.70.02"", ""3.70.03"", ""3.70.18""]",https://oeil.secure.europarl.europa.eu/oeil/popups/ficheprocedure.do?reference=2021/0207(COD)&l=en,Procedure completed
2021/0214(COD),Carbon Border Adjustment Mechanism,Type.COD,2021-07-14,"[""2.10.01"", ""3.70.02"", ""3.70.03"", ""3.70.15"", ""6.20""]",https://oeil.secure.europarl.europa.eu/oeil/popups/ficheprocedure.do?reference=2021/0214(COD)&l=en,Procedure completed
2021/0197(COD),CO2 emission standards for cars and vans,Type.COD,2021-07-14,"[""2.10.03"", ""3.20.05"", ""3.40.03"", ""3.70.02""]",https://oeil.secure.europarl.europa.eu/oeil/popups/ficheprocedure.do?reference=2021/0197(COD)&l=en,Procedure completed
2021/0203(COD),Energy Efficiency Directive,Type.COD,2021-07-14,"[""3.60.08""]",https://oeil.secure.europarl.europa.eu/oeil/popups/ficheprocedure.do?reference=2021/0203(COD)&l=en,Procedure completed
2021/0201(COD),"Land use, land use change and forestry (LULUCF)",Type.COD,2021-07-14,"[""3.10.11"", ""3.10.14.04"", ""3.70.02"", ""3.70.03"", ""3.70.18""]",https://oeil.secure.europarl.europa.eu/oeil/popups/ficheprocedure.do?reference=2021/0201(COD)&l=en,Procedure completed
2021/0218(COD),Renewable Energy Directive,Type.COD,2021-07-14,"[""3.60.05""]",https://oeil.secure.europarl.europa.eu/oeil/popups/ficheprocedure.do?reference=2021/0218(COD)&l=en,Procedure completed
2021/0223(COD),Deployment of alternative fuels infrastructure,Type.COD,2021-07-14,"[""3.20.05"", ""3.60.02"", ""3.60.05""]",https://oeil.secure.europarl.europa.eu/oeil/popups/ficheprocedure.do?reference=2021/0223(COD)&l=en,Procedure completed
2021/0205(COD),Sustainable aviation fuels (ReFuelEU Aviation Initiative),Type.COD,2021-07-14,"[""3.20.01"", ""3.60.02"", ""3.60.05"", ""3.70.02"", ""3.70.03""]",https://oeil.secure.europarl.europa.eu/oeil/popups/ficheprocedure.do?reference=2021/0205(COD)&l=en,Procedure completed
2021/0206(COD),Social Climate Fund,Type.COD,2021-07-14,"[""3.20"", ""3.60.08"", ""3.70.03"", ""4.10.05"", ""4.70.01""]",https://oeil.secure.europarl.europa.eu/oeil/popups/ficheprocedure.do?reference=2021/0206(COD)&l=en,Procedure completed
2021/0210(COD),Sustainable maritime fuels (FuelEU Maritime Initiative),Type.COD,2021-07-14,"[""3.20.03"", ""3.60.02"", ""3.60.05"", ""3.70.02"", ""3.70.03""]",https://oeil.secure.europarl.europa.eu/oeil/popups/ficheprocedure.do?reference=2021/0210(COD)&l=en,Procedure completed
2021/0200(COD),Binding annual greenhouse gas emission reductions by Member States (Effort Sharing Regulation),Type.COD,2021-07-14,"[""3.70.02"", ""3.70.03"", ""3.70.18""]",https://oeil.secure.europarl.europa.eu/oeil/popups/ficheprocedure.do?reference=2021/0200(COD)&l=en,Procedure completed
2021/0208(NLE),Convention on the Recognition and Enforcement of Foreign Judgments in Civil or Commercial Matters: accession by the European Union,Type.NLE,2021-07-16,"[""7.40.02""]",https://oeil.secure.europarl.europa.eu/oeil/popups/ficheprocedure.do?reference=2021/0208(NLE)&l=en,Awaiting final decision
2021/0219(COD),Undertakings for collective investment in transferable securities (UCITS): the use of key information documents,Type.COD,2021-07-15,"[""2.50.03"", ""2.50.10""]",https://oeil.secure.europarl.europa.eu/oeil/popups/ficheprocedure.do?reference=2021/0219(COD)&l=en,Procedure completed
2021/0215(COD),Packaged retail and insurance-based investment products (PRIIPs): key information documents. Extension of the transitional arrangement,Type.COD,2021-07-15,"[""2.50.03"", ""2.50.05"", ""2.50.08"", ""2.50.10"", ""4.60.06""]",https://oeil.secure.europarl.europa.eu/oeil/popups/ficheprocedure.do?reference=2021/0215(COD)&l=en,Procedure completed
2021/0241(COD),Information accompanying transfers of funds and certain crypto-assets,Type.COD,2021-07-20,"[""2.50.04.02"", ""2.50.10"", ""7.30.20"", ""7.30.30.08""]",https://oeil.secure.europarl.europa.eu/oeil/popups/ficheprocedure.do?reference=2021/0241(COD)&l=en,Procedure completed
2021/0242(COD),Conservation of the Southern Bluefin Tuna: conservation and management measures,Type.COD,2021-07-28,"[""3.15.01"", ""3.15.07"", ""3.15.15""]",https://oeil.secure.europarl.europa.eu/oeil/popups/ficheprocedure.do?reference=2021/0242(COD)&l=en,Procedure completed
2021/0248(COD),General Fisheries Commission for the Mediterranean (GFCM): fishing in the GFCM Agreement area. Recast,Type.COD,2021-07-30,"[""3.15.01"", ""3.15.04""]",https://oeil.secure.europarl.europa.eu/oeil/popups/ficheprocedure.do?reference=2021/0248(COD)&l=en,Procedure completed
2021/0270(COD),Integrated farm statistics: Union contribution under the 2021-2027 financial framework,Type.COD,2021-08-12,"[""3.10.30""]",https://oeil.secure.europarl.europa.eu/oeil/popups/ficheprocedure.do?reference=2021/0270(COD)&l=en,Procedure completed
2021/0275(COD),Transport of dangerous goods by road: uniform procedures for checks. Codification,Type.COD,2021-08-19,"[""3.20.05"", ""3.70.13""]",https://oeil.secure.europarl.europa.eu/oeil/popups/ficheprocedure.do?reference=2021/0275(COD)&l=en,Procedure completed
2021/0266(NLE),Schengen Information System (SIS): application of the provisions of the Schengen acquis in Cyprus,Type.NLE,2021-08-12,"[""7.10.02"", ""7.10.04""]",https://oeil.secure.europarl.europa.eu/oeil/popups/ficheprocedure.do?reference=2021/0266(NLE)&l=en,Awaiting final decision
2021/2878(RSP),Resolution on the situation in Lebanon,Type.RSP,2021-09-14,"[""6.10.04"", ""6.10.05""]",https://oeil.secure.europarl.europa.eu/oeil//popups/ficheprocedure.do?reference=2021/2878(RSP)&l=en,Procedure completed
2021/2880(RSP),Resolution on media freedom and further deterioration of the rule of law in Poland,Type.RSP,2021-09-15,"[""3.30.08"", ""8.30.10""]",https://oeil.secure.europarl.europa.eu/oeil/popups/ficheprocedure.do?reference=2021/2880(RSP)&l=en,Procedure completed
2021/2877(RSP),Resolution on the situation in Afghanistan,Type.RSP,2021-09-14,"[""6.10.04"", ""6.10.09""]",https://oeil.secure.europarl.europa.eu/oeil//popups/ficheprocedure.do?reference=2021/2877(RSP)&l=en,Procedure completed
2021/2678(RSP),"Resolution on EU transparency in the development, purchase and distribution of COVID-19 vaccines",Type.RSP,2021-09-16,"[""4.20.01"", ""4.20.02""]",https://oeil.secure.europarl.europa.eu/oeil/popups/ficheprocedure.do?reference=2021/2678(RSP)&l=en,Procedure completed
2021/2873(RSP),Resolution on the case of human rights defender Ahmed Mansoor in the United Arab Emirates,Type.RSP,2021-09-16,"[""6.10.08""]",https://oeil.secure.europarl.europa.eu/oeil//popups/ficheprocedure.do?reference=2021/2873(RSP)&l=en,Procedure completed
2021/2872(RSP),Resolution on the government crackdown on protests and citizens in Cuba,Type.RSP,2021-09-16,"[""6.10.04"", ""6.10.08""]",https://oeil.secure.europarl.europa.eu/oeil//popups/ficheprocedure.do?reference=2021/2872(RSP)&l=en,Procedure completed
2021/2874(RSP),Resolution on the situation in Kakuma refugee camp in Kenya,Type.RSP,2021-09-16,"[""6.10.08"", ""6.10.09""]",https://oeil.secure.europarl.europa.eu/oeil//popups/ficheprocedure.do?reference=2021/2874(RSP)&l=en,Procedure completed
2021/0291(COD),Radio Equipment Directive: common charger for electronic devices,Type.COD,2021-09-17,"[""2.10.03"", ""3.30.01"", ""3.30.04"", ""3.40.06"", ""4.20"", ""4.60.08""]",https://oeil.secure.europarl.europa.eu/oeil/popups/ficheprocedure.do?reference=2021/0291(COD)&l=en,Procedure completed
2021/2881(RSP),Resolution on the situation in Belarus after one year of protests and their violent repression,Type.RSP,2021-10-05,"[""6.10.04""]",https://oeil.secure.europarl.europa.eu/oeil/popups/ficheprocedure.do?reference=2021/2881(RSP)&l=en,Procedure completed
2021/2910(RSP),"Resolution on the state law relating to abortion in Texas, USA",Type.RSP,2021-10-07,"[""4.10.09"", ""6.10.08""]",https://oeil.secure.europarl.europa.eu/oeil/popups/ficheprocedure.do?reference=2021/2910(RSP)&l=en,Procedure completed
2021/2905(RSP),"Resolution on the human rights situation in Myanmar, including the situation of religious and ethnic groups",Type.RSP,2021-10-07,"[""6.10.04"", ""6.10.08""]",https://oeil.secure.europarl.europa.eu/oeil/popups/ficheprocedure.do?reference=2021/2905(RSP)&l=en,Procedure completed
2021/2902(RSP),Resolution on the humanitarian situation in Tigray,Type.RSP,2021-10-05,"[""6.10.04"", ""6.10.05"", ""6.50""]",https://oeil.secure.europarl.europa.eu/oeil/popups/ficheprocedure.do?reference=2021/2902(RSP)&l=en,Procedure completed
2021/2906(RSP),Resolution on the case of Paul Rusesabagina in Rwanda,Type.RSP,2021-10-07,"[""6.10.08""]",https://oeil.secure.europarl.europa.eu/oeil/popups/ficheprocedure.do?reference=2021/2906(RSP)&l=en,Procedure completed
2021/2869(RSP),"Resolution on Commission Implementing Regulation (EU) 2021/1449 of 3 September 2021 amending Implementing Regulation (EU) No 540/2011 as regards the extension of the approval periods of the active substances 2-phenylphenol (including its salts such as the sodium salt), 8-hydroxyquinoline, amidosulfuron, bifenox, chlormequat, chlorotoluron, clofentezine, clomazone, cypermethrin, daminozide, deltamethrin, dicamba, difenoconazole, diflufenican, dimethachlor, etofenprox, fenoxaprop-P, fenpropidin, fludioxonil, flufenacet, fosthiazate, indoxacarb, lenacil, MCPA, MCPB, nicosulfuron, paraffin oils, paraffin oil, penconazole, picloram, propaquizafop, prosulfocarb, quizalofop-P-ethyl, quizalofop-P-tefuryl, sulphur, tetraconazole, tri-allate, triflusulfuron and tritosulfuron",Type.RSP,2021-10-05,"[""3.10.09""]",https://oeil.secure.europarl.europa.eu/oeil/popups/ficheprocedure.do?reference=2021/2869(RSP)&l=en,Procedure completed
2021/2917(RSO),"Decision on setting up a delegation to the EU-UK Parliamentary Partnership Assembly, and defining its numerical strength",Type.RSO,2021-10-05,"[""8.40.01.06""]",https://oeil.secure.europarl.europa.eu/oeil/popups/ficheprocedure.do?reference=2021/2917(RSO)&l=en,Procedure completed
2021/2913(DEA),Determining cases where identity data may be considered as same or similar for the purpose of the multiple identity detection pursuant to Regulation (EU) 2019/817,Type.DEA,2021-09-29,"[""7.10.04""]",https://oeil.secure.europarl.europa.eu/oeil/popups/ficheprocedure.do?reference=2021/2913(DEA)&l=en,Procedure completed - delegated act rejected
2021/2912(DEA),Determining cases where identity data may be considered as same or similar for the purpose of the multiple identity detection pursuant to Regulation (EU) 2019/818,Type.DEA,2021-09-29,"[""7.10.06"", ""7.10.08"", ""7.30.05"", ""7.40""]",https://oeil.secure.europarl.europa.eu/oeil/popups/ficheprocedure.do?reference=2021/2912(DEA)&l=en,Procedure completed - delegated act rejected
2021/0293(COD),2030 policy programme “Path to the Digital Decade”,Type.COD,2021-09-15,"[""3.30.06"", ""3.30.25""]",https://oeil.secure.europarl.europa.eu/oeil/popups/ficheprocedure.do?reference=2021/0293(COD)&l=en,Procedure completed
2021/0300(NLE),EU/Mauritania Sustainable Fisheries Partnership Agreement and Implementing Protocol,Type.NLE,2021-09-28,"[""3.15.15.02""]",https://oeil.secure.europarl.europa.eu/oeil/popups/ficheprocedure.do?reference=2021/0300(NLE)&l=en,Procedure completed
2021/2922(RSP),"Resolution on the Pandora Papers: implications for the efforts to combat money laundering, tax evasion and tax avoidance",Type.RSP,2021-10-06,"[""3.45.04"", ""7.30.30.08""]",https://oeil.secure.europarl.europa.eu/oeil/popups/ficheprocedure.do?reference=2021/2922(RSP)&l=en,Procedure completed
2021/2923(RSP),"Resolution on the climate, energy and environmental State aid guidelines (CEEAG)",Type.RSP,2021-10-19,"[""2.60.03""]",https://oeil.secure.europarl.europa.eu/oeil/popups/ficheprocedure.do?reference=2021/2923(RSP)&l=en,Procedure completed
2021/2903(RSP),Resolution on the situation in Tunisia,Type.RSP,2021-10-19,"[""6.10.04""]",https://oeil.secure.europarl.europa.eu/oeil//popups/ficheprocedure.do?reference=2021/2903(RSP)&l=en,Procedure completed
2021/2925(RSP),Resolution on the first anniversary of the de facto abortion ban in Poland,Type.RSP,2021-10-20,"[""1.10"", ""4.10.09""]",https://oeil.secure.europarl.europa.eu/oeil//popups/ficheprocedure.do?reference=2021/2925(RSP)&l=en,Procedure completed
2021/0312(NLE),EU/Cook Islands Sustainable Fisheries Partnership Agreement: implementation of the Agreement 2021-2024. Protocol,Type.NLE,2021-10-06,"[""3.15.15.06""]",https://oeil.secure.europarl.europa.eu/oeil/popups/ficheprocedure.do?reference=2021/0312(NLE)&l=en,Procedure completed
2021/2667(RSP),"Resolution on the 2021 UN Climate Change Conference in Glasgow, UK (COP26)",Type.RSP,2021-10-20,"[""3.70.03"", ""3.70.18""]",https://oeil.secure.europarl.europa.eu/oeil//popups/ficheprocedure.do?reference=2021/2667(RSP)&l=en,Procedure completed
2021/0326(BUD),"Amending budget 6/2021: additional vaccines doses to low and lower-middle income countries, UCPM reinforcement and other adjustments to expenditure and revenue",Type.BUD,2021-10-08,"[""8.70.51""]",https://oeil.secure.europarl.europa.eu/oeil/popups/ficheprocedure.do?reference=2021/0326(BUD)&l=en,Procedure completed
2021/2620(RSP),Resolution on the introduction of a European social security pass for improving the digital enforcement of social security rights and fair mobility,Type.RSP,2021-11-22,"[""1.20.09"", ""2.30"", ""4.15.04"", ""4.15.12"", ""7.10""]",https://oeil.secure.europarl.europa.eu/oeil/popups/ficheprocedure.do?reference=2021/2620(RSP)&l=en,Procedure completed
2021/2769(RSP),"Resolution on multilateral negotiations in view of the 12th WTO Ministerial Conference in Geneva, 30 November to 3 December 2021",Type.RSP,2021-11-23,"[""6.20.01"", ""6.20.05""]",https://oeil.secure.europarl.europa.eu/oeil/popups/ficheprocedure.do?reference=2021/2769(RSP)&l=en,Procedure completed
2021/0323(COD),Transitional provisions for certain in vitro diagnostic medical devices and deferred application of requirements for in-house devices,Type.COD,2021-10-14,"[""2.10.03"", ""3.40.11"", ""4.20.05"", ""4.60.08""]",https://oeil.secure.europarl.europa.eu/oeil/popups/ficheprocedure.do?reference=2021/0323(COD)&l=en,Procedure completed
2021/0328(COD),European Year of Youth 2022,Type.COD,2021-10-14,"[""4.15.02"", ""4.40.01"", ""4.40.10""]",https://oeil.secure.europarl.europa.eu/oeil/popups/ficheprocedure.do?reference=2021/0328(COD)&l=en,Procedure completed
2021/2169(INI),The state of play in the implementation of the Common Fisheries Policy and future perspectives,Type.INI,2021-10-07,"[""3.15""]",https://oeil.secure.europarl.europa.eu/oeil/popups/ficheprocedure.do?reference=2021/2169(INI)&l=en,Procedure completed
2021/2935(RSP),Resolution on the rule of law crisis in Poland and the primacy of EU law,Type.RSP,2021-10-19,"[""8.30.10"", ""8.50""]",https://oeil.secure.europarl.europa.eu/oeil/popups/ficheprocedure.do?reference=2021/2935(RSP)&l=en,Procedure completed
2021/2187(INI),Access to water as a human right - the external dimension,Type.INI,2021-10-07,"[""3.70.04"", ""6.10.09""]",https://oeil.secure.europarl.europa.eu/oeil/popups/ficheprocedure.do?reference=2021/2187(INI)&l=en,Procedure completed
2021/2189(INI),Striving for a sustainable and competitive EU aquaculture: the way forward,Type.INI,2021-10-07,"[""3.15.02"", ""3.70.20""]",https://oeil.secure.europarl.europa.eu/oeil/popups/ficheprocedure.do?reference=2021/2189(INI)&l=en,Procedure completed
2021/2170(INI),Women’s poverty in Europe,Type.INI,2021-10-07,"[""4.10.05"", ""4.10.09""]",https://oeil.secure.europarl.europa.eu/oeil/popups/ficheprocedure.do?reference=2021/2170(INI)&l=en,Procedure completed
2021/2179(INI),The EU Action plan for the social economy,Type.INI,2021-10-07,"[""3.45.07""]",https://oeil.secure.europarl.europa.eu/oeil/popups/ficheprocedure.do?reference=2021/2179(INI)&l=en,Procedure completed
2021/2168(INI),The implementation of Article 17 of the Common Fisheries Policy Regulation,Type.INI,2021-10-07,"[""3.15""]",https://oeil.secure.europarl.europa.eu/oeil/popups/ficheprocedure.do?reference=2021/2168(INI)&l=en,Procedure completed
2021/2165(INI),"A new EU strategic framework on health and safety at work post 2020 (including a better protection of workers from exposure to harmful substances, stress at work and repetitive motion injuries)",Type.INI,2021-10-07,"[""4.15.15""]",https://oeil.secure.europarl.europa.eu/oeil/popups/ficheprocedure.do?reference=2021/2165(INI)&l=en,Procedure completed
2021/2161(INL),Digitalisation and Administrative Law,Type.INL,2021-10-07,"[""1.20.05"", ""3.30.06""]",https://oeil.secure.europarl.europa.eu/oeil/popups/ficheprocedure.do?reference=2021/2161(INL)&l=en,Procedure completed
2021/2176(INI),The future of EU international investment policy,Type.INI,2021-10-07,"[""2.50.03"", ""6.20.06"", ""6.30.02""]",https://oeil.secure.europarl.europa.eu/oeil/popups/ficheprocedure.do?reference=2021/2176(INI)&l=en,Procedure completed
