reference,title,type,date,subject,url,status
2022/0326(COD),European Year of Skills 2023,Type.COD,2022-10-12,"[""3.30.06"", ""4.15"", ""4.40.01"", ""4.40.15""]",https://oeil.secure.europarl.europa.eu/oeil/popups/ficheprocedure.do?reference=2022/0326(COD)&l=en,Procedure completed
2022/0302(COD),Liability for defective products,Type.COD,2022-09-28,"[""4.60.06"", ""4.60.08""]",https://oeil.secure.europarl.europa.eu/oeil/popups/ficheprocedure.do?reference=2022/0302(COD)&l=en,Awaiting Council's 1st reading position
2022/2785(RSP),"Resolution on Commission Implementing Regulation (EU) 2022/1480 of 7 September 2022 amending Implementing Regulation (EU) No 540/2011 as regards the extension of the approval periods of the active substances 2-phenylphenol (including its salts such as the sodium salt), 8-hydroxyquinoline, amidosulfuron, bensulfuron, bifenox, chlormequat, chlorotoluron, clofentezine, clomazone, daminozide, deltamethrin, dicamba, difenoconazole, diflufenican, dimethachlor, esfenvalerate, etofenprox, fenoxaprop-P, fenpropidin, fenpyrazamine, fludioxonil, flufenacet, flumetralin, fosthiazate, lenacil, MCPA, MCPB, nicosulfuron, paraffin oils, paraffin oil, penconazole, picloram, prohexadione, propaquizafop, prosulfocarb, quizalofop-P-ethyl, quizalofop-P-tefuryl, sodium 5-nitroguaiacolate, sodium o-nitrophenolate, sodium p-nitrophenolate, sulphur, tebufenpyrad, tetraconazole, tri-allate, triflusulfuron and tritosulfuron",Type.RSP,2022-10-18,"[""3.10.09""]",https://oeil.secure.europarl.europa.eu/oeil/popups/ficheprocedure.do?reference=2022/2785(RSP)&l=en,Procedure completed
2022/2896(RSP),Resolution on recognising the Russian Federation as a state sponsor of terrorism,Type.RSP,2022-10-18,"[""6.40.04.02"", ""7.30.20""]",https://oeil.secure.europarl.europa.eu/oeil/popups/ficheprocedure.do?reference=2022/2896(RSP)&l=en,Procedure completed
2022/2901(RSP),"Resolution on prevention, management and better care of diabetes in the EU on the occasion of World Diabetes Day",Type.RSP,2022-11-21,"[""4.20.01""]",https://oeil.secure.europarl.europa.eu/oeil/popups/ficheprocedure.do?reference=2022/2901(RSP)&l=en,Procedure completed
2022/2899(DEA),Value of the clearing threshold for positions held in OTC commodity derivative contracts and other OTC derivative contracts,Type.DEA,2022-10-18,"[""2.50.03"", ""2.50.08"", ""2.50.10""]",https://oeil.secure.europarl.europa.eu/oeil/popups/ficheprocedure.do?reference=2022/2899(DEA)&l=en,Procedure completed - delegated act enters into force
2022/2894(RSP),Resolution on growing hate crimes against LGBTIQ+ people across Europe in light of the recent homophobic murder in Slovakia,Type.RSP,2022-10-18,"[""1.10"", ""4.10.08"", ""7.30.30""]",https://oeil.secure.europarl.europa.eu/oeil/popups/ficheprocedure.do?reference=2022/2894(RSP)&l=en,Procedure completed
2022/2151(INI),European Semester for economic policy coordination: Employment and social priorities for 2023,Type.INI,2022-10-20,"[""4.10"", ""4.15"", ""5.10.01""]",https://oeil.secure.europarl.europa.eu/oeil/popups/ficheprocedure.do?reference=2022/2151(INI)&l=en,Procedure completed
2022/2154(INI),Strengthening the right to participate: legitimacy and resilience of electoral processes in illiberal political systems and authoritarian regimes,Type.INI,2022-10-20,"[""6.10.08"", ""6.10.09""]",https://oeil.secure.europarl.europa.eu/oeil/popups/ficheprocedure.do?reference=2022/2154(INI)&l=en,Procedure completed
2022/2146(INI),Further reform of corporate taxation rules,Type.INI,2022-10-20,"[""3.45.04""]",https://oeil.secure.europarl.europa.eu/oeil/popups/ficheprocedure.do?reference=2022/2146(INI)&l=en,Procedure completed
2022/2147(INI),Assessment of the new communication of the European Commission on Outermost Regions,Type.INI,2022-10-20,"[""4.70.06"", ""6.30""]",https://oeil.secure.europarl.europa.eu/oeil/popups/ficheprocedure.do?reference=2022/2147(INI)&l=en,Procedure completed
2022/2148(INI),The implications of Chinese fishing operations on EU fisheries and the way forward,Type.INI,2022-10-20,"[""3.15""]",https://oeil.secure.europarl.europa.eu/oeil/popups/ficheprocedure.do?reference=2022/2148(INI)&l=en,Procedure completed
2022/2145(INI),"EU Rapid Deployment Capacity, EU Battlegroups and Article 44 TEU: the way forward",Type.INI,2022-10-20,"[""6.10""]",https://oeil.secure.europarl.europa.eu/oeil/popups/ficheprocedure.do?reference=2022/2145(INI)&l=en,Procedure completed
2022/2150(INI),European Semester for economic policy coordination 2023,Type.INI,2022-10-20,"[""5.10.01""]",https://oeil.secure.europarl.europa.eu/oeil/popups/ficheprocedure.do?reference=2022/2150(INI)&l=en,Procedure completed
2022/2149(INI),"The System of European Schools: State of play, Challenges and Perspectives",Type.INI,2022-10-20,"[""4.40.03""]",https://oeil.secure.europarl.europa.eu/oeil/popups/ficheprocedure.do?reference=2022/2149(INI)&l=en,Procedure completed
2022/2153(INI),Resolution on the control of the financial activities of the European Investment Bank – Annual Report 2021,Type.INI,2022-10-20,"[""8.40.07""]",https://oeil.secure.europarl.europa.eu/oeil/popups/ficheprocedure.do?reference=2022/2153(INI)&l=en,Procedure completed
2022/2152(INI),Resolution on the protection of the European Union’s financial interests – combating fraud – annual report 2021,Type.INI,2022-10-20,"[""8.70.04""]",https://oeil.secure.europarl.europa.eu/oeil/popups/ficheprocedure.do?reference=2022/2152(INI)&l=en,Procedure completed
2022/2172(INI),Own Resources: A new start for EU finances. A new start for Europe,Type.INI,2022-11-24,"[""8.70.01""]",https://oeil.secure.europarl.europa.eu/oeil/popups/ficheprocedure.do?reference=2022/2172(INI)&l=en,Procedure completed
2022/0341(COD),Instant payments in euro,Type.COD,2022-10-26,"[""2.50.04.02"", ""5.20.02""]",https://oeil.secure.europarl.europa.eu/oeil/popups/ficheprocedure.do?reference=2022/0341(COD)&l=en,Procedure completed
2022/0345(COD),Urban wastewater treatment. Recast,Type.COD,2022-10-26,"[""3.70.04""]",https://oeil.secure.europarl.europa.eu/oeil/popups/ficheprocedure.do?reference=2022/0345(COD)&l=en,Awaiting Parliament's position in 1st reading
2022/0347(COD),Ambient air quality and cleaner air for Europe. Recast,Type.COD,2022-10-26,"[""3.70.02""]",https://oeil.secure.europarl.europa.eu/oeil/popups/ficheprocedure.do?reference=2022/0347(COD)&l=en,Awaiting Parliament's position in 1st reading
2022/0344(COD),Protection of groundwater against pollution and environmental quality standards in the field of water policy,Type.COD,2022-10-26,"[""3.70.04""]",https://oeil.secure.europarl.europa.eu/oeil/popups/ficheprocedure.do?reference=2022/0344(COD)&l=en,Awaiting Parliament's position in 1st reading
2022/0348(COD),"Laying down management, conservation and control measures applicable in the Area covered under the Southern Indian Ocean Fisheries Agreement (SIOFA)",Type.COD,2022-11-04,"[""3.15.15.03""]",https://oeil.secure.europarl.europa.eu/oeil/popups/ficheprocedure.do?reference=2022/0348(COD)&l=en,Awaiting Council's 1st reading position
2022/2934(RSP),Resolution on the outcome of the modernisation of the Energy Charter Treaty,Type.RSP,2022-11-09,"[""3.60"", ""3.60.15""]",https://oeil.secure.europarl.europa.eu/oeil/popups/ficheprocedure.do?reference=2022/2934(RSP)&l=en,Procedure completed
2022/0364(NLE),Marrakesh Agreement establishing the World Trade Organization (WTO): Agreement on Fisheries Subsidies. Protocol,Type.NLE,2022-11-09,"[""6.20.01""]",https://oeil.secure.europarl.europa.eu/oeil/popups/ficheprocedure.do?reference=2022/0364(NLE)&l=en,Procedure completed
2022/0365(COD),Type-approval of motor vehicles and engines with respect to their emissions and battery durability (Euro 7),Type.COD,2022-11-10,"[""2.10.03"", ""3.20.06"", ""3.40.03"", ""3.70.02""]",https://oeil.secure.europarl.europa.eu/oeil/popups/ficheprocedure.do?reference=2022/0365(COD)&l=en,Awaiting Council's 1st reading position
2022/0358(COD),Data collection and sharing relating to short-term accommodation rental services,Type.COD,2022-11-07,"[""1.20.05"", ""2.80"", ""3.30.06"", ""4.50""]",https://oeil.secure.europarl.europa.eu/oeil/popups/ficheprocedure.do?reference=2022/0358(COD)&l=en,Awaiting Council's 1st reading position
2022/0362(NLE),EU/Seychelles Agreement: access for Seychelles fishing vessels to the waters of Mayotte,Type.NLE,2022-11-10,"[""3.15.15.03""]",https://oeil.secure.europarl.europa.eu/oeil/popups/ficheprocedure.do?reference=2022/0362(NLE)&l=en,Awaiting final decision
2022/2957(RSP),Resolution on the forced displacement of people as a result of the escalating conflict in eastern Democratic Republic of the Congo (DRC),Type.RSP,2022-11-23,"[""6.10.04"", ""6.10.09""]",https://oeil.secure.europarl.europa.eu/oeil/popups/ficheprocedure.do?reference=2022/2957(RSP)&l=en,Procedure completed
2022/2956(RSP),The continuing repression of the democratic opposition and civil society in Belarus,Type.RSP,2022-11-23,"[""6.10.08""]",https://oeil.secure.europarl.europa.eu/oeil/popups/ficheprocedure.do?reference=2022/2956(RSP)&l=en,Procedure completed
2022/2955(RSP),"Resolution on the human rights situation in Afghanistan, especially the deterioration of women’s rights and attacks against educational institutions",Type.RSP,2022-11-23,"[""6.10.08"", ""6.10.09""]",https://oeil.secure.europarl.europa.eu/oeil/popups/ficheprocedure.do?reference=2022/2955(RSP)&l=en,Procedure completed
2022/2948(RSP),Resolution on the situation of human rights in the context of the FIFA World Cup in Qatar,Type.RSP,2022-11-21,"[""6.10.09""]",https://oeil.secure.europarl.europa.eu/oeil/popups/ficheprocedure.do?reference=2022/2948(RSP)&l=en,Procedure completed
2022/2935(RSP),Resolution on the assessment of Hungary’s compliance with the rule of law conditions under the Conditionality Regulation and state of play of the Hungarian RRP,Type.RSP,2022-11-21,"[""8.30.10"", ""8.70""]",https://oeil.secure.europarl.europa.eu/oeil/popups/ficheprocedure.do?reference=2022/2935(RSP)&l=en,Procedure completed
2022/2952(RSP),Resolution on the protection of livestock farming and large carnivores in Europe,Type.RSP,2022-11-23,"[""3.10.04""]",https://oeil.secure.europarl.europa.eu/oeil/popups/ficheprocedure.do?reference=2022/2952(RSP)&l=en,Procedure completed
2022/2962(RSP),Reolution on the human rights situation in Egypt,Type.RSP,2022-11-23,"[""6.10.08"", ""6.10.09""]",https://oeil.secure.europarl.europa.eu/oeil/popups/ficheprocedure.do?reference=2022/2962(RSP)&l=en,Procedure completed
2022/0372(NLE),Geneva Act of the Lisbon Agreement on Appellations of Origin and Geographical Indications: accession of the European Union,Type.NLE,2022-11-17,"[""3.50.15""]",https://oeil.secure.europarl.europa.eu/oeil/popups/ficheprocedure.do?reference=2022/0372(NLE)&l=en,Procedure completed
2022/0377(NLE),EU/Brazil Agreement: modification of concessions on all the tariff rate quotas included in the EU Schedule CLXXV as a consequence of the United Kingdom`s withdrawal from the European Union,Type.NLE,2022-11-18,"[""6.20.03"", ""6.20.04""]",https://oeil.secure.europarl.europa.eu/oeil/popups/ficheprocedure.do?reference=2022/0377(NLE)&l=en,Procedure completed
2022/0379(COD),Measures for a high level of public sector interoperability across the Union (Interoperable Europe Act),Type.COD,2022-11-18,"[""2.40.02"", ""2.80"", ""3.30.06""]",https://oeil.secure.europarl.europa.eu/oeil/popups/ficheprocedure.do?reference=2022/0379(COD)&l=en,Procedure completed
2022/2185(BUI),"2024 budget: estimates of revenue and expenditure for the financial year 2024, Section I – European Parliament",Type.BUI,2023-04-17,"[""8.70.54""]",https://oeil.secure.europarl.europa.eu/oeil/popups/ficheprocedure.do?reference=2022/2185(BUI)&l=en,Procedure completed
2022/2184(BUI),Guidelines for the 2024 Budget - Section III,Type.BUI,2023-03-28,"[""8.70.54""]",https://oeil.secure.europarl.europa.eu/oeil/popups/ficheprocedure.do?reference=2022/2184(BUI)&l=en,Procedure lapsed or withdrawn
2022/2170(INI),Job creation: just transition and impact investment,Type.INI,2022-11-24,"[""4.15""]",https://oeil.secure.europarl.europa.eu/oeil/popups/ficheprocedure.do?reference=2022/2170(INI)&l=en,Procedure completed
2022/2182(INI),Generational renewal in the EU farms of the future,Type.INI,2022-11-24,"[""3.10.01""]",https://oeil.secure.europarl.europa.eu/oeil/popups/ficheprocedure.do?reference=2022/2182(INI)&l=en,Procedure completed
2022/2183(INI),Ensuring food security and the long-term resilience of EU agriculture,Type.INI,2022-11-24,"[""3.10"", ""3.10.01"", ""3.10.10"", ""6.50""]",https://oeil.secure.europarl.europa.eu/oeil/popups/ficheprocedure.do?reference=2022/2183(INI)&l=en,Procedure completed
2022/2171(INI),EU Strategy for Sustainable and Circular Textiles,Type.INI,2022-11-24,"[""3.40.10"", ""3.70.20""]",https://oeil.secure.europarl.europa.eu/oeil/popups/ficheprocedure.do?reference=2022/2171(INI)&l=en,Procedure completed
2022/0390(COD),Labelling of organic pet food,Type.COD,2022-11-28,"[""3.10.03"", ""3.10.09.04"", ""3.70.17""]",https://oeil.secure.europarl.europa.eu/oeil/popups/ficheprocedure.do?reference=2022/0390(COD)&l=en,Procedure completed
2022/0398(COD),Definition of criminal offences and penalties for the violation of Union restrictive measures,Type.COD,2022-12-02,"[""6.10.05"", ""6.10.08"", ""7.30.30"", ""7.40.04""]",https://oeil.secure.europarl.europa.eu/oeil/popups/ficheprocedure.do?reference=2022/0398(COD)&l=en,Awaiting Council's 1st reading position
2022/0391(COD),Industrial property: protection of Community design,Type.COD,2022-11-28,"[""3.50.16""]",https://oeil.secure.europarl.europa.eu/oeil/popups/ficheprocedure.do?reference=2022/0391(COD)&l=en,Awaiting Council's 1st reading position
2022/0394(COD),Union certification framework for carbon removals,Type.COD,2022-11-30,"[""2.10.03"", ""3.70.02""]",https://oeil.secure.europarl.europa.eu/oeil/popups/ficheprocedure.do?reference=2022/0394(COD)&l=en,Awaiting Parliament's position in 1st reading
2022/0392(COD),Industrial property: legal protection of designs. Recast,Type.COD,2022-11-28,"[""3.50.16""]",https://oeil.secure.europarl.europa.eu/oeil/popups/ficheprocedure.do?reference=2022/0392(COD)&l=en,Awaiting Council's 1st reading position
2022/0396(COD),Packaging and packaging waste,Type.COD,2022-11-30,"[""3.70.12""]",https://oeil.secure.europarl.europa.eu/oeil/popups/ficheprocedure.do?reference=2022/0396(COD)&l=en,Awaiting Parliament's position in 1st reading
2022/0906(COD),Statute of the Court of Justice: amendment of Protocol No 3,Type.COD,2022-12-05,"[""8.40.04""]",https://oeil.secure.europarl.europa.eu/oeil/popups/ficheprocedure.do?reference=2022/0906(COD)&l=en,Awaiting signature of act
2022/0409(CNS),Value added tax (VAT): administrative cooperation arrangements needed for the digital age,Type.CNS,2022-12-08,"[""2.70.02"", ""2.80"", ""3.30.06""]",https://oeil.secure.europarl.europa.eu/oeil/popups/ficheprocedure.do?reference=2022/0409(CNS)&l=en,Awaiting final decision
2022/0407(CNS),Common system of value added tax (VAT): rules for the digital age,Type.CNS,2022-12-08,"[""2.70.02"", ""3.30.06""]",https://oeil.secure.europarl.europa.eu/oeil/popups/ficheprocedure.do?reference=2022/0407(CNS)&l=en,Awaiting final decision
2022/0402(CNS),"Jurisdiction, applicable law, recognition of decisions and acceptance of authentic instruments in matters of parenthood and creation of a European Certificate of Parenthood",Type.CNS,2022-12-07,"[""4.10.03"", ""7.40.02""]",https://oeil.secure.europarl.europa.eu/oeil/popups/ficheprocedure.do?reference=2022/0402(CNS)&l=en,Awaiting final decision
2022/0413(CNS),Taxation: administrative cooperation,Type.CNS,2022-12-08,"[""2.70"", ""2.80""]",https://oeil.secure.europarl.europa.eu/oeil/popups/ficheprocedure.do?reference=2022/0413(CNS)&l=en,Procedure completed
2022/3017(RSP),Resolution on the establishment of a tribunal on the crime of aggression against Ukraine,Type.RSP,2023-01-17,"[""6.10.04""]",https://oeil.secure.europarl.europa.eu/oeil/popups/ficheprocedure.do?reference=2022/3017(RSP)&l=en,Procedure completed
2022/0417(COD),Fees and charges payable to the European Medicines Agency,Type.COD,2022-12-13,"[""4.20.04"", ""8.40.08""]",https://oeil.secure.europarl.europa.eu/oeil/popups/ficheprocedure.do?reference=2022/0417(COD)&l=en,Procedure completed
2022/3015(RSP),Resolution on the 30th anniversary of the single market: celebrating achievements and looking towards future developments,Type.RSP,2023-01-16,"[""2""]",https://oeil.secure.europarl.europa.eu/oeil/popups/ficheprocedure.do?reference=2022/3015(RSP)&l=en,Procedure completed
2022/0419(NLE),EU/Japan Agreement: air services,Type.NLE,2022-12-15,"[""3.20.15.02""]",https://oeil.secure.europarl.europa.eu/oeil/popups/ficheprocedure.do?reference=2022/0419(NLE)&l=en,Procedure completed
2022/0221M(NLE),EU-Malaysia Partnership and Cooperation Agreement,Type.NLE,2023-01-19,"[""6.40.08""]",https://oeil.secure.europarl.europa.eu/oeil/popups/ficheprocedure.do?reference=2022/0221M(NLE)&l=en,Procedure completed
2022/0252M(NLE),EU-Thailand Partnership and Cooperation Agreement,Type.NLE,2023-01-19,"[""6.40.08""]",https://oeil.secure.europarl.europa.eu/oeil/popups/ficheprocedure.do?reference=2022/0252M(NLE)&l=en,Procedure completed
2022/2188(INI),Implementation report on the EU-UK Trade and Cooperation Agreement,Type.INI,2022-12-15,"[""6.20.03"", ""6.40""]",https://oeil.secure.europarl.europa.eu/oeil/popups/ficheprocedure.do?reference=2022/2188(INI)&l=en,Procedure completed
2022/0432(COD),"Classification, labelling and packaging of substances and mixtures",Type.COD,2022-12-19,"[""3.40.01"", ""3.70.13"", ""4.60.02""]",https://oeil.secure.europarl.europa.eu/oeil/popups/ficheprocedure.do?reference=2022/0432(COD)&l=en,Awaiting Parliament's position in 1st reading
2022/2196(INI),The implementation of civilian CSDP and other EU civilian security assistance,Type.INI,2023-01-19,"[""6.10.02"", ""6.10.05""]",https://oeil.secure.europarl.europa.eu/oeil/popups/ficheprocedure.do?reference=2022/2196(INI)&l=en,Procedure completed
2022/2202(INI),2022 Commission Report on Montenegro,Type.INI,2023-01-19,"[""8.20.01""]",https://oeil.secure.europarl.europa.eu/oeil/popups/ficheprocedure.do?reference=2022/2202(INI)&l=en,Procedure completed
2022/2194(INL),Amending the proposed mechanism to resolve legal and administrative obstacles in a cross-border context,Type.INL,2023-01-19,"[""2.80"", ""4.70.05"", ""7.40.02""]",https://oeil.secure.europarl.europa.eu/oeil/popups/ficheprocedure.do?reference=2022/2194(INL)&l=en,Procedure completed
2022/2195(INI),Report on Uzbekistan,Type.INI,2023-01-19,"[""6.10.04"", ""6.10.08"", ""6.10.09""]",https://oeil.secure.europarl.europa.eu/oeil/popups/ficheprocedure.do?reference=2022/2195(INI)&l=en,Procedure completed
2022/2206(INI),Implementation of the Regulations on the European citizens' initiative,Type.INI,2023-01-19,"[""1.20""]",https://oeil.secure.europarl.europa.eu/oeil/popups/ficheprocedure.do?reference=2022/2206(INI)&l=en,Procedure completed
2022/2204(INI),2022 Commission Report on Serbia,Type.INI,2023-01-19,"[""8.20.01""]",https://oeil.secure.europarl.europa.eu/oeil/popups/ficheprocedure.do?reference=2022/2204(INI)&l=en,Procedure completed
2022/2207(INI),Fostering and adapting vocational training as a tool for employees' success and a building block for the EU economy in the new industry 4.0,Type.INI,2023-01-19,"[""4.40.15""]",https://oeil.secure.europarl.europa.eu/oeil/popups/ficheprocedure.do?reference=2022/2207(INI)&l=en,Procedure completed
2023/2000(INI),How to build an innovative humanitarian aid strategy: spotlight on current and forgotten crises,Type.INI,2023-01-19,"[""6.50""]",https://oeil.secure.europarl.europa.eu/oeil/popups/ficheprocedure.do?reference=2023/2000(INI)&l=en,Procedure completed
2023/2003(INI),Implementation of the current Creative Europe Programme 2021-2027,Type.INI,2023-01-19,"[""3.30.01.02"", ""4.45.02""]",https://oeil.secure.europarl.europa.eu/oeil/popups/ficheprocedure.do?reference=2023/2003(INI)&l=en,Procedure completed
2023/2004(INI),Implementation of the current CERV Programme 2021-2027 – Citizens’ engagement and participation,Type.INI,2023-01-19,"[""1.10"", ""1.20"", ""4.10.04.01"", ""4.10.08"", ""8.30.10""]",https://oeil.secure.europarl.europa.eu/oeil/popups/ficheprocedure.do?reference=2023/2004(INI)&l=en,Procedure completed
2023/2002(INI),Implementation of the current Erasmus+ Programme 2021-2027,Type.INI,2023-01-19,"[""4.10.13"", ""4.40"", ""4.40.20""]",https://oeil.secure.europarl.europa.eu/oeil/popups/ficheprocedure.do?reference=2023/2002(INI)&l=en,Procedure completed
2023/2001(INI),Implementation of the EU-Canada Comprehensive Economic and Trade Agreement (CETA),Type.INI,2023-01-19,"[""6.20.03""]",https://oeil.secure.europarl.europa.eu/oeil/popups/ficheprocedure.do?reference=2023/2001(INI)&l=en,Procedure completed
2022/2200(INI),2022 Commission Report on Bosnia and Herzegovina,Type.INI,2023-01-19,"[""8.20""]",https://oeil.secure.europarl.europa.eu/oeil/popups/ficheprocedure.do?reference=2022/2200(INI)&l=en,Procedure completed
2022/2201(INI),2022 Commission Report on Kosovo,Type.INI,2023-01-19,"[""8.20""]",https://oeil.secure.europarl.europa.eu/oeil/popups/ficheprocedure.do?reference=2022/2201(INI)&l=en,Procedure completed
2022/2198(INI),"Virtual worlds: opportunities, risks and policy implications for the Single Market",Type.INI,2023-01-19,"[""2"", ""3.30.06""]",https://oeil.secure.europarl.europa.eu/oeil/popups/ficheprocedure.do?reference=2022/2198(INI)&l=en,Procedure completed
2022/2197(INI),The situation of children deprived of liberty in the world,Type.INI,2023-01-19,"[""4.10.03""]",https://oeil.secure.europarl.europa.eu/oeil/popups/ficheprocedure.do?reference=2022/2197(INI)&l=en,Procedure completed
2022/2199(INI),2022 Commission Report on Albania,Type.INI,2023-01-19,"[""8.20.01""]",https://oeil.secure.europarl.europa.eu/oeil/popups/ficheprocedure.do?reference=2022/2199(INI)&l=en,Procedure completed
2022/2205(INI),2022 Commission Report on Türkiye,Type.INI,2023-01-19,"[""8.20.01""]",https://oeil.secure.europarl.europa.eu/oeil/popups/ficheprocedure.do?reference=2022/2205(INI)&l=en,Procedure completed
2022/2839(RSP),Resolution on the EU priorities for the 67th session of the UN Commission on the Status of Women,Type.RSP,2023-02-14,"[""4.10.09"", ""6.40.13""]",https://oeil.secure.europarl.europa.eu/oeil/popups/ficheprocedure.do?reference=2022/2839(RSP)&l=en,Procedure completed
2022/2840(RSP),Resolution on adequate minimum income ensuring active inclusion,Type.RSP,2023-03-14,"[""4.10.05""]",https://oeil.secure.europarl.europa.eu/oeil/popups/ficheprocedure.do?reference=2022/2840(RSP)&l=en,Procedure completed
2022/2982(RSP),Resolution on the Commission communication on ensuring availability and affordability of fertilisers,Type.RSP,2023-02-16,"[""3.40.01""]",https://oeil.secure.europarl.europa.eu/oeil/popups/ficheprocedure.do?reference=2022/2982(RSP)&l=en,Procedure completed
2023/2509(RSP),Resolution on the preparation of the EU-Ukraine Summit,Type.RSP,2023-02-02,"[""6.40.02""]",https://oeil.secure.europarl.europa.eu/oeil/popups/ficheprocedure.do?reference=2023/2509(RSP)&l=en,Procedure completed
2023/2506(RSP),"Resolution on the situation of journalists in Morocco, notably the case of Omar Radi",Type.RSP,2023-01-18,"[""6.10.08""]",https://oeil.secure.europarl.europa.eu/oeil/popups/ficheprocedure.do?reference=2023/2506(RSP)&l=en,Procedure completed
2023/2505(RSP),Resolution on the storming of the Brazilian democratic institutions,Type.RSP,2023-01-18,"[""6.10.04""]",https://oeil.secure.europarl.europa.eu/oeil/popups/ficheprocedure.do?reference=2023/2505(RSP)&l=en,Procedure completed
2023/2504(RSP),Resolution on the humanitarian consequences of the blockade in Nagorno-Karabakh,Type.RSP,2023-01-18,"[""6.10.04""]",https://oeil.secure.europarl.europa.eu/oeil/popups/ficheprocedure.do?reference=2023/2504(RSP)&l=en,Procedure completed
2023/2511(RSP),Resolution on the EU response to the protests and executions in Iran,Type.RSP,2023-01-17,"[""6.10.04"", ""6.10.09""]",https://oeil.secure.europarl.europa.eu/oeil/popups/ficheprocedure.do?reference=2023/2511(RSP)&l=en,Procedure completed
2023/2513(RSP),"Resolution on an EU strategy to boost industrial competitiveness, trade and quality jobs",Type.RSP,2023-01-18,"[""3.40"", ""3.40.14"", ""4.15"", ""6.20""]",https://oeil.secure.europarl.europa.eu/oeil/popups/ficheprocedure.do?reference=2023/2513(RSP)&l=en,Procedure completed
2022/2210(REG),Amendments to Parliament’s Rules of Procedure concerning Rule 7 on defence of privileges and immunity and Rule 9 on procedures on immunity,Type.REG,2023-01-12,"[""8.40.01.08""]",https://oeil.secure.europarl.europa.eu/oeil/popups/ficheprocedure.do?reference=2022/2210(REG)&l=en,Procedure completed
2023/0018(COD),Macro-financial assistance to Moldova,Type.COD,2023-01-24,"[""6.20.07""]",https://oeil.secure.europarl.europa.eu/oeil/popups/ficheprocedure.do?reference=2023/0018(COD)&l=en,Procedure completed
2023/2543(RSP),Resolution on the situation of the former President of Georgia Mikheil Saakashvili,Type.RSP,2023-02-02,"[""6.10.04""]",https://oeil.secure.europarl.europa.eu/oeil/popups/ficheprocedure.do?reference=2023/2543(RSP)&l=en,Procedure completed
2023/0022(NLE),Geneva Act of the Lisbon Agreement on Appellations of Origin and Geographical Indications: accession of the European Union,Type.NLE,2023-02-06,"[""3.50.15""]",https://oeil.secure.europarl.europa.eu/oeil/popups/ficheprocedure.do?reference=2023/0022(NLE)&l=en,"Procedure completed, awaiting publication in Official Journal"
2023/0034(COD),Macro-financial assistance to North Macedonia,Type.COD,2023-02-06,"[""6.20.07"", ""6.40.03""]",https://oeil.secure.europarl.europa.eu/oeil/popups/ficheprocedure.do?reference=2023/0034(COD)&l=en,Procedure completed
